{
  "meta": {
    "title": "Flappy Bird",
    "genre": "runner",
    "camera": "side",
    "dimension": "2D",
    "version": "1.0"
  },
  "settings": {
    "gravity": 800,
    "backgroundColor": "#87CEEB",
    "worldWidth": 800,
    "worldHeight": 600
  },
  "scene": {
    "type": "single",
    "cameraFollow": "player"
  },
  "entities": [
    {
      "id": "player",
      "type": "player",
      "sprite": "bird",
      "position": { "x": 100, "y": 300 },
      "physics": {
        "collidable": true
      },
      "components": ["jump", "keyboardInput"]
    },
    {
      "id": "pipe-top",
      "type": "obstacle",
      "sprite": "pipe-top",
      "position": { "x": 400, "y": 150 },
      "physics": {
        "collidable": true,
        "static": true
      },
      "components": []
    },
    {
      "id": "pipe-bottom",
      "type": "obstacle",
      "sprite": "pipe-bottom",
      "position": { "x": 400, "y": 450 },
      "physics": {
        "collidable": true,
        "static": true
      },
      "components": []
    }
  ],
  "systems": ["physics", "input", "collision"],
  "mechanics": ["jump", "avoid"],
  "scoring": {
    "type": "distance",
    "increment": 1
  },
  "ui": {
    "hud": ["score"],
    "startScreen": true,
    "gameOverScreen": true
  },
  "assets": [
    {
      "id": "bird",
      "type": "sprite",
      "source": "placeholder"
    },
    {
      "id": "pipe-top",
      "type": "sprite",
      "source": "placeholder"
    },
    {
      "id": "pipe-bottom",
      "type": "sprite",
      "source": "placeholder"
    }
  ],
  "extensions": {}
}
