{
  "meta": {
    "title": "Space Runner",
    "genre": "runner",
    "camera": "side",
    "dimension": "2D",
    "version": "1.0"
  },
  "settings": {
    "gravity": 300,
    "backgroundColor": "#000011",
    "worldWidth": 800,
    "worldHeight": 600
  },
  "scene": {
    "type": "single",
    "cameraFollow": "player"
  },
  "entities": [
    {
      "id": "player",
      "type": "player",
      "sprite": "spaceship",
      "position": { "x": 100, "y": 300 },
      "physics": {
        "collidable": true
      },
      "components": ["jump", "keyboardInput"]
    },
    {
      "id": "asteroid",
      "type": "enemy",
      "sprite": "asteroid",
      "position": { "x": 600, "y": 300 },
      "physics": {
        "collidable": true
      },
      "components": ["patrol"]
    },
    {
      "id": "coin",
      "type": "pickup",
      "sprite": "coin",
      "position": { "x": 500, "y": 200 },
      "physics": {
        "collidable": true
      },
      "components": []
    }
  ],
  "systems": ["physics", "input", "collision", "ai"],
  "mechanics": ["jump", "collect", "avoid"],
  "scoring": {
    "type": "collect",
    "increment": 10
  },
  "ui": {
    "hud": ["score"],
    "startScreen": true,
    "gameOverScreen": true
  },
  "assets": [
    {
      "id": "spaceship",
      "type": "sprite",
      "source": "placeholder"
    },
    {
      "id": "asteroid",
      "type": "sprite",
      "source": "placeholder"
    },
    {
      "id": "coin",
      "type": "sprite",
      "source": "placeholder"
    }
  ],
  "extensions": {}
}
